#,Friends?,Sheath (t0),Sh/FR mix (t1),FR Start (t2),FR End (t3),Leg End (t4),Mixed End (t5),Unconf?,HSScat,Data Gap?,Comments
1,2,1995-02-07T18:48,1995-02-08T03:21,1995-02-08T06:10,1995-02-08T21:00,-,1995-02-09T01:50,,-,A,Some mixing between sheath and FR?
2,1,1995-02-09T01:50,-,1995-02-09T07:17,1995-02-10T01:21,-,1995-02-10T04:00,,-,A,Somewhat arbitrary split between prev mixed and this sheath
3,-,1995-03-04T00:36,-,1995-03-04T11:23,1995-03-05T00:09,-,1995-03-05T03:06,,-,A,
4,-,1995-03-06T02:11,-,1995-03-06T07:11,1995-03-07T02:23,-,-,,-,A,Fairly straightforward weak case
5,-,1995-03-23T09:45,-,1995-03-23T22:11,1995-03-24T16:11,-,-,Y,-,A,There is an enhancement but no obvious B rot. Not not certain what this is
6,-,1995-04-01T13:46,-,1995-04-01T16:34,1995-04-02T03:21,-,1995-04-02T05:43,,-,A,Little B rotation but Bx/Bz smooth
7,-,1995-04-03T06:43,-,1995-04-03T12:45,1995-04-04T12:52,-,-,,G,A,Not sure if G HSS is thing but do see compression behind
8,-,1995-04-05T07:11,-,1995-04-05T17:59,1995-04-06T12:31,-,1995-04-06T17:15,H,G,A,Is sheath just part of HSS plateau? FR is ugly and not really fast enough for much sheath
9,-,-,-,1995-05-13T10:19,1995-05-13T15:28,-,1995-05-13T16:54,,-,A,
10,-,1995-06-30T09:21,1995-06-30T14:23,1995-06-30T21:34,1995-07-01T06:59,-,1995-07-01T12:42,,-,A,Too large of a gap to interact with next?
11,-,-,-,1995-07-01T21:00,1995-07-02T10:26,-,1995-07-02T16:08,,-,A,Too large of a gap to interact with prev?
12,-,1995-08-22T12:56,-,1995-08-22T22:19,1995-08-23T18:43,-,-,,-,A,
13,-,-,-,1995-09-15T18:17,1995-09-16T03:09,-,-,,G,AW,Data gap so no clue what that compression is behind
14,-,1995-09-27T09:21,1995-09-27T11:48,1995-09-27T14:00,1995-09-27T21:00,-,-,Y,-,A,Not sure what Wind cat is doing. Might be weak unIDed HSS?
15,-,1995-10-18T10:40,-,1995-10-18T19:11,1995-10-19T17:54,-,1995-10-20T01:48,,G,A,
16,-,-,-,1995-12-02T12:30,1995-12-02T19:02,-,1995-12-02T21:55,,-,A,
17,-,1995-12-15T14:52,1995-12-16T00:28,1995-12-16T07:11,1995-12-16T19:11,-,1995-12-16T22:17,Y,-,A,Might be multi CMEs? Take Dreams sheath and make current ICE sheath bonus FR? Ugly but phi/T sigs
18,-,-,-,1996-02-15T15:40,1996-02-15T19:55,1996-02-16T03:25,1996-02-16T08:59,Y,-,AW,Ugly FR but with different regions and not sure on spliting
19,-,-,-,1996-04-04T12:21,1996-04-04T20:56,-,-,,-,A,
20,-,1996-05-16T23:04,1996-05-17T00:44,1996-05-17T02:14,1996-05-17T09:53,-,1996-05-17T11:06,,-,A,
21,-,1996-05-27T11:59,-,1996-05-27T15:00,1996-05-28T23:14,-,1996-05-29T07:18,,-,A,Suspicious of FR length but no clear splitting point
22,-,1996-07-01T13:05,-,1996-07-01T17:16,1996-07-02T08:50,-,1996-07-02T11:00,,X,A,Could be interacting with next but gap region pretty quiet?
23,-,1996-07-02T14:40,-,1996-07-02T16:50,1996-07-02T22:47,-,1996-07-03T01:53,,GX,A,Could be interacting with prev but gap region pretty quiet?
24,-,1996-08-07T08:23,-,1996-08-07T11:59,1996-08-08T04:59,-,1996-08-08T10:18,,X,A,Maybe interacting with very tail of HSS but prob negligible effects if so
25,26,1996-12-24T01:26,-,1996-12-24T03:07,1996-12-24T13:41,-,1996-12-24T16:23,,X,A,Add bonus mini FR right in front? (23 18:45ish). Mixed is from interaction with next
26,25,1996-12-24T13:41,-,1996-12-24T16:23,1996-12-25T11:24,-,-,,-,A,Two FR regions or just a messy single?
27,-,1997-01-10T00:52,-,1997-01-10T04:47,1997-01-10T18:20,1997-01-11T00:50,1997-01-11T03:06,,GX,A,Not sure on FR split but strong T change. Interacts with HSS behind
28,-,1997-02-09T12:50,1997-02-09T21:16,1997-02-10T02:52,1997-02-10T18:28,-,-,,X,A,Could probably make sheath three regions (split at 09 16:30)
29,-,1997-04-10T17:45,1997-04-11T06:00,1997-04-11T08:18,1997-04-11T14:56,-,1997-04-11T19:00,,X,A,Turbulent flux rope front set as mixed
30,-,1997-04-21T10:11,-,1997-04-21T15:42,1997-04-22T11:38,1997-04-23T01:40,1997-04-23T10:30,FR2,X,A,Not sure on splitting FR
31,32,1997-05-15T01:15,1997-05-15T05:21,1997-05-15T10:00,1997-05-15T23:29,-,1997-05-16T03:13,,GX,A,
32,31,1997-05-16T03:13,1997-05-16T06:01,1997-05-16T08:26,1997-05-16T13:26,-,1997-05-16T15:55,M1,G,A,Not sure on front mixed
33,-,1997-05-26T09:09,1997-05-26T16:12,1997-05-26T21:16,1997-05-27T06:20,-,1997-05-27T13:24,M1,-,A,Not sure on front mixed. Bx pretty turbulent but could change to two FR regs or just one big ugly one
34,-,-,-,1997-06-09T06:18,1997-06-09T23:01,-,-,Y,X,A,Completely uncertain. Might have sheath or be two events. Picked smoothest B rot part as FR
35,-,1997-06-19T00:32,-,1997-06-19T07:24,1997-06-19T15:54,1997-06-20T22:29,-,H,X,A,FR2 region could just be HSS?
36,-,1997-07-15T03:10,1997-07-15T06:11,1997-07-15T09:00,1997-07-15T21:31,1997-07-16T11:00,-,FR2,-,A,Back reg FR2 or mixed? Or nothing
37,-,1997-08-03T10:10,1997-08-03T13:00,1997-08-03T14:18,1997-08-03T20:14,1997-08-03T23:38,1997-08-04T02:07,,X,A,
38,-,1997-08-17T01:56,1997-08-17T04:50,1997-08-17T05:35,1997-08-17T17:26,-,1997-08-17T19:33,S;M1,X,A,Sheath start unclear but following others. Not sure on front mixed
39,-,1997-09-03T08:38,-,1997-09-03T13:26,1997-09-03T20:41,-,1997-09-04T03:39,M2,GX,A,Mixed from HSS pushing at back but not sure on exact range
40,-,1997-09-18T00:30,-,1997-09-18T04:07,1997-09-19T03:32,-,-,E,X,A,Is this a CME? Some B rot and low T but also super turbulent so I guessed and gave up. Maybe FR at 20 00:00
41,-,1997-09-21T16:51,1997-09-21T22:21,1997-09-22T01:30,1997-09-22T12:20,-,1997-09-22T17:46,S;M1,X,A,Sheath start unclear but following others. Not sure on front mixed
42,-,1997-10-01T01:41,1997-10-01T11:45,1997-10-01T17:00,1997-10-02T23:00,-,-,Y,X,AW,Ugly and data gaps so complete guess
43,-,1997-10-10T16:12,-,1997-10-10T22:00,1997-10-11T14:33,-,1997-10-12T02:18,Y,X,A,RC says 2 FR but don't really see first one (in sheath)
44,-,1997-10-27T01:38,-,1997-10-27T10:35,1997-10-28T04:57,-,-,Y,X,A,Weak case. Hard to say much with confidence
45,-,1997-11-06T22:25,-,1997-11-07T06:00,1997-11-08T05:56,1997-11-08T14:26,1997-11-08T19:23,Y,X,-,Maybe mixed in front but short. Could be multiple events. Could be regions of HSS
46,47,1997-11-22T09:12,1997-11-22T15:13,1997-11-22T18:51,1997-11-23T12:50,-,1997-11-23T19:00,M1,X,-,Not sure where to split front mixed region from sheath
47,46,1997-11-23T12:50,1997-11-24T03:43,1997-11-24T06:51,1997-11-25T00:00,-,1997-11-25T07:53,,-,-,
48,49,1997-12-10T04:33,-,1997-12-10T18:39,1997-12-11T10:14,-,1997-12-11T13:15,,X,-,Might have front mixed but cannot confidently add
49,48,1997-12-11T10:14,-,1997-12-11T13:15,1997-12-11T23:52,-,-,,-,-,Weak case but probably a thing based on T
50,-,1997-12-30T01:13,-,1997-12-30T09:35,1997-12-30T17:18,1997-12-31T06:45,1997-12-31T11:00,M2,X,A,Guesing where second mixed ends
51,52,1998-01-06T13:29,1998-01-06T22:50,1998-01-07T02:23,1998-01-08T07:28,-,1998-01-08T15:49,,X,W,
52,51,-,-,1998-01-08T15:49,1998-01-08T21:11,-,1998-01-08T23:52,M2,X,-,Guesing where second mixed ends
53,-,-,-,1998-01-09T08:23,1998-01-09T20:38,-,-,,-,-,
54,55,1998-01-20T07:08,-,1998-01-20T17:43,1998-01-21T04:00,-,-,,X,-,
55,54,1998-01-21T04:00,-,1998-01-21T07:00,1998-01-22T01:06,1998-01-22T10:50,1998-01-30T23:08,FR2;M2,-,-,Long and messy and guessing
56,-,1998-01-28T16:00,1998-01-29T13:12,1998-01-29T20:00,1998-01-30T06:24,1998-01-30T23:08,1998-01-31T02:08,Y,-,-,Complicated so massive guess
57,-,-,-,1998-02-02T13:13,1998-02-03T12:38,-,1998-02-04T02:22,Y,X,-,Wind says one big event. Dreams say 2. I'm not confident it is anything at all
58,-,1998-02-04T00:00,1998-02-04T02:22,1998-02-04T04:48,1998-02-05T22:30,-,1998-02-06T08:04,,X,-,Could maybe split FR at 05 03:50. Pretty smooth rot but huge
59,-,1998-02-17T06:28,1998-02-17T09:10,1998-02-17T10:00,1998-02-17T20:39,-,1998-02-18T07:50,,-,-,Unsure on back mixed region
60,-,1998-02-18T07:50,1998-02-18T14:52,1998-02-18T21:35,1998-02-19T04:54,1998-02-20T00:29,-,FR2,X,-,FR2 could just be HSS plateau?
61,-,1998-03-04T11:02,-,1998-03-04T14:38,1998-03-05T20:29,-,1998-03-06T07:10,,X,-,
62,-,1998-03-06T17:46,1998-03-06T11:59,1998-03-06T22:17,1998-03-07T09:36,-,1998-03-07T16:48,,-,-,A little guessing on mixed
63,-,1998-03-25T10:48,1998-03-25T13:00,1998-03-25T16:12,1998-03-26T09:11,-,1998-03-26T10:00,,-,-,
64,65,1998-03-30T22:00,1998-03-31T05:58,1998-03-31T11:59,1998-04-01T17:40,-,-,,-,-,Maybe split FR at kink in middle? Fairly similar on both side tho
65,64,1998-04-01T17:40,1998-04-01T20:30,1998-04-01T23:29,1998-04-02T16:41,-,1998-04-02T19:55,M2,-,-,Could start back mixed region at Dreams boundary instead?
66,-,-,-,1998-04-11T23:00,1998-04-13T03:59,-,-,Y,X,-,Could split to mixed or extend back end? Whole thing is pretty messy except for tiny bit in middle
67,69,1998-05-01T21:21,1998-05-02T03:37,1998-05-02T11:49,1998-05-03T16:47,-,1998-05-04T02:21,,X,-,Not sure what CDAW is doing
69,67; 70,1998-05-04T02:21,1998-05-04T05:01,1998-05-04T11:42,1998-05-05T01:52,-,1998-05-05T05:06,M2,X,-,End of back mixed semi arbitrary
70,69,1998-05-05T05:06,-,1998-05-05T07:03,1998-05-06T02:31,1998-05-07T10:56,1998-05-07T22:49,H,X,~W,Some portion of FR might just be HSS?
71,-,1998-06-02T08:00,-,1998-06-02T10:28,1998-06-02T16:43,-,1998-06-02T19:00,,X,-,
72,-,1998-06-13T19:25,1998-06-13T22:03,1998-06-14T02:21,1998-06-14T23:21,-,1998-06-15T06:00,M1;M2,X,-,Precise bounds on mixed regions unclear
73,75,1998-06-24T10:00,-,1998-06-24T13:26,1998-06-25T16:03,-,1998-06-25T23:28,,X,-,
75,73,1998-06-25T16:03,-,1998-06-25T23:28,1998-06-26T07:48,1998-06-26T19:39,-,,-,-,
76,77,1998-07-05T03:15,-,1998-07-06T08:22,1998-07-07T14:06,-,-,S,X,-,Not confident in mega sheath? Is part SIR?
77,76,1998-07-07T14:06,-,1998-07-07T15:20,1998-07-09T05:56,-,-,H,-,-,Might just be tail of HSS?
78,-,1998-07-10T23:00,1998-07-11T05:02,1998-07-11T15:27,1998-07-12T06:01,1998-07-12T17:20,1998-07-12T22:39,Y,X,-,Is def a thing but hard to split up bc pretty messy
79,-,1998-08-01T08:20,1998-08-01T13:31,1998-08-01T21:12,1998-08-02T07:42,1998-08-03T03:12,1998-08-03T10:3,M1,X,-,
80,-,-,-,1998-08-05T13:00,1998-08-06T07:16,-,1998-08-06T12:00,E,-,-,This could be nothing
81,-,1998-08-07T11:00,-,1998-08-08T02:19,1998-08-08T14:36,1998-08-09T13:19,1998-08-10T00:31,Y,X,-,Guessing on splits
82,-,1998-08-10T00:31,1998-08-10T04:47,1998-08-10T13:30,1998-08-10T23:30,-,-,M1,X,-,
83,-,-,-,1998-08-12T01:00,1998-08-12T20:19,1998-08-13T14:00,-,E,-,-,Is this a thing?
84,-,1998-08-19T18:40,1998-08-20T05:28,1998-08-20T09:11,1998-08-21T19:18,-,-,,-,-,Could split FR?
85,-,1998-08-26T06:51,1998-08-26T22:00,1998-08-27T05:38,1998-08-27T19:59,-,1998-08-28T00:45,M1,X,-,Front mixed could be FR?
86,-,1998-09-23T01:12,-,1998-09-23T04:00,1998-09-23T14:39,-,1998-09-23T17:51,,X,-,
87,-,1998-09-24T23:18,1998-09-25T02:34,1998-09-25T06:16,1998-09-25T21:12,1998-09-26T09:58,1998-09-26T16:28,,X,-,
88,-,-,-,-,-,-,-,H,GX,-,Think this is just HSS
89,-,1998-10-18T19:30,-,1998-10-19T04:19,1998-10-19T14:51,1998-10-20T07:01,-,,GX,-,
90,-,1998-10-23T12:57,-,1998-10-23T19:55,1998-10-24T19:02,-,-,,X,-,
91,92,1998-11-07T08:15,-,1998-11-07T22:21,1998-11-08T04:41,-,1998-11-08T08:08,,X,-,
92,91;93,1998-11-08T04:51,1998-11-08T23:48,1998-11-09T03:45,1998-11-10T01:48,-,1998-11-10T05:51,,-,-,
93,92,1998-11-13T02:00,-,1998-11-13T04:30,1998-11-14T06:44,-,1998-11-14T10:15,Y,G,W,Guessing. Wind is drunk
94,-,1998-11-30T05:06,-,1998-11-30T10:08,1998-11-30T18:20,-,1998-12-01T04:00,M2,X,-,Back mixed region could be ugly FR? Messy and hard to tell
95,-,1998-12-28T18:26,-,1998-12-29T18:00,1998-12-31T02:00,-,-,E,X,AW,Is this a thing?
96,-,-,-,1999-01-04T04:00,1999-01-04T23:29,-,-,,-,-,
97,-,1999-01-13T10:54,-,1999-01-13T16:05,1999-01-13T23:00,-,-,,GX,W,Wind is drunk
98,-,1999-01-22T20:24,-,1999-01-23T09:35,1999-01-23T14:38,-,1999-01-23T18:00,,X,-,Could add front mixed but not sure where to draw line
99,-,-,-,1999-02-11T17:41,1999-02-12T03:35,-,-,E,GX,-,Is this a thing?
100,-,-,-,1999-02-13T19:00,1999-02-14T16:22,-,-,,GX,-,Ugly but enough of a T signature
101,102,-,-,1999-02-16T15:40,1999-02-17T07:09,-,-,,X,-,
102,101; 103,1999-02-17T07:09,-,1999-02-17T12:23,1999-02-18T02:46,-,-,,X,-,
103,102;104,1999-02-18T02:48,1999-02-18T10:30,1999-02-18T14:18,1999-02-19T08:15,-,1999-02-19T12:18,,X,-,
104,103,1999-02-19T12:18,-,1999-02-19T23:49,1999-02-20T18:34,-,-,S,-,-,Guessing is sheath until next but not certain
105,-,1999-03-10T01:30,1999-03-10T12:20,1999-03-10T18:18,1999-03-11T02:26,1999-03-12T02:00,-,,GX,W,Wind is drunk
106,-,1999-03-19T09:43,-,1999-03-19T12:21,1999-03-20T06:09,-,1999-03-20T13:13,Y,X,W,Messy and guessing especially on mixed
107,-,1999-04-16T11:25,1999-04-16T15:54,1999-04-16T22:37,1999-04-17T10:03,-,1999-04-17T20:45,Y,-,-,Guessing on front mixed and not splitting up FR
108,-,1999-04-20T16:00,1999-04-21T04:53,1999-04-21T12:37,1999-04-22T14:00,-,-,,X,W,Don't know how much to trust Wind B when plasma is bad
109,-,-,1999-05-15T16:00,1999-05-16T09:14,1999-05-18T00:38,-,-,H,GX,-,Long T signature but not much else. Might just be HSS tail?
110,-,-,-,1999-05-28T21:50,1999-05-29T22:08,-,-,Y,-,-,Not confident is thing
111,-,1999-06-02T20:40,1999-06-02T23:00,1999-06-03T00:31,1999-06-03T12:59,1999-06-03T22:00,-,,X,-,
112,-,1999-06-26T02:31,-,1999-06-26T06:00,1999-06-26T19:25,-,-,H,X,-,Think stuff behind is all too turbulent for FR and is HSS?
113,114,1999-07-02T00:59,1999-07-02T23:07,1999-07-03T08:09,1999-07-05T13:57,-,1999-07-05T21:00,M1,X,-,
114,113; 115,-,-,1999-07-05T21:00,1999-07-06T14:24,-,1999-07-06T18:38,,X,-,Could split FR?
115,114; 116,1999-07-06T15:09,-,1999-07-06T21:36,1999-07-07T06:00,1999-07-07T17:02,1999-07-08T03:42,M2,X,-,Front FR could be mixed instead?
116,115,1999-07-08T03:42,-,1999-07-08T10:02,1999-07-08T22:11,-,-,Y,-,-,Not sure what this is. Kind of smooth and rot B but still turbulent and not much T drop
117,-,1999-07-26T23:51,-,1999-07-27T16:05,1999-07-29T09:56,-,-,Y,X,-,Ugly FR. Could add mixed on both ends but hard to say where
118,119,1999-07-30T19:12,-,1999-07-31T02:02,1999-07-31T18:00,-,1999-07-31T20:22,Y,X,-,Micro FR in sheath? Confusing messy case
119,118; 120,1999-07-31T20:22,-,1999-08-01T04:14,1999-08-02T04:12,-,1999-08-02T11:00,S,-,-,Sheath or just some sort of mixed region in front?
120,119,1999-08-02T11:00,1999-08-02T15:36,1999-08-02T18:55,1999-08-03T03:08,-,1999-08-03T10:39,M,-,-,Guessing on mixed bounds
121,-,-,-,-,-,-,-,H,X,-,Think this is HSS
122,-,1999-08-08T17:44,1999-08-09T04:52,1999-08-09T10:19,1999-08-10T10:45,-,1999-08-10T16:15,,X,-,
123,-,1999-08-12T04:59,1999-08-12T12:32,1999-08-12T21:50,1999-08-14T00:00,-,-,,X,-,Add mixed at back?
124,-,-,-,1999-08-21T15:18,1999-08-22T22:23,-,1999-08-23T10:40,FR,X,-,Weak FR signatures. Might be real. Might just be HSS tail
125,-,1999-09-15T07:44,-,1999-09-15T08:40,1999-09-15T17:30,-,-,E,X,-,Some B enhancement but not much else
126,127,-,-,1999-09-21T20:25,1999-09-22T05:06,1999-09-22T11:31,1999-09-22T12:09,,X,-,Too slow (comp to background) to form sheath?
127,126,1999-09-22T12:09,1999-09-22T19:00,1999-09-22T23:24,1999-09-23T09:35,1999-09-24T02:33,-,Y,X,-,Mixed/FR bounds hard to place
128,-,1999-10-21T02:19,1999-10-21T04:41,1999-10-21T09:22,1999-10-22T03:19,-,1999-10-22T06:38,,X,-,Could split FR?
129,130,-,1999-11-12T10:00,1999-11-12T19:00,1999-11-13T20:26,-,1999-11-13T20:26,Y,X,W,Forms no sheath since in fast wind? Could just be HSS tail?
130,129,1999-11-13T20:26,-,1999-11-14T15:17,1999-11-16T07:17,-,-,E,GX,AW,Not sure is thing. Lots of data gaps and suspicious Wind. Made minimal guess
131,132,1999-11-22T00:00,-,1999-11-22T04:42,1999-11-22T14:13,-,-,,X,-,
132,131; 133,1999-11-23T01:59,-,1999-11-23T06:52,1999-11-23T19:44,-,-,,-,-,
133,132,1999-11-23T19:44,-,1999-11-23T20:19,1999-11-24T07:39,-,-,,-,-,Basing sheath on T
134,135,1999-12-12T15:50,1999-12-12T17:31,1999-12-12T20:11,1999-12-13T14:42,-,1999-12-13T23:00,,X,W,
135,134,1999-12-13T23:00,-,1999-12-14T04:00,1999-12-14T19:31,-,-,Y,X,W,Mostly going on T
136,-,-,-,-,-,-,-,,X,-,Cannot say this is a thing
137,-,1999-12-26T22:39,1999-12-27T09:22,1999-12-27T19:43,1999-12-28T04:39,-,-,Y,X,W,Generally uncertain
138,-,2000-01-22T00:23,-,2000-01-22T17:00,2000-01-23T01:45,-,2000-01-23T03:48,S,X,W,FR from T sig
139,140,2000-02-11T02:35,2000-02-11T08:17,2000-02-11T17:39,2000-02-11T23:31,-,2000-02-12T02:55,,X,-,
140,139,2000-02-11T23:31,2000-02-12T07:41,2000-02-12T12:20,2000-02-12T17:29,-,-,,-,-,
141,-,2000-02-14T07:11,2000-02-14T10:37,2000-02-14T17:25,2000-02-15T08:00,2000-02-15T15:33,-,FR2,-,~W,
142,-,2000-02-20T21:03,2000-02-21T05:00,2000-02-21T13:21,2000-02-22T12:14,-,2000-02-22T14:46,,X,-,Could split FR?
143,144,2000-03-01T01:58,-,2000-03-01T03:34,2000-03-01T18:58,-,-,,X,-,
144,143,2000-03-01T18:58,-,2000-03-01T20:16,2000-03-02T03:05,-,2000-03-02T05:13,,-,-,
145,146,2000-03-18T22:00,2000-03-19T03:55,2000-03-19T02:00,2000-03-19T12:17,-,2000-03-19T15:40,,X,-,
146,145,2000-03-19T15:40,-,2000-03-19T17:49,2000-03-20T05:35,-,-,,X,-,See T sig but not much else
147,148,2000-03-28T02:52,-,2000-03-28T11:16,2000-03-29T11:00,-,2000-03-29T19:00,,X,-,
148,147; 149,2000-03-29T11:00,-,2000-03-29T23:44,2000-03-30T14:35,-,-,M2,X,-,Not sure what back mixed is. Actually mixed or FR2 or just HSS?
149,148,2000-03-30T14:35,2000-03-30T23:04,2000-03-31T03:09,2000-03-31T23:00,-,2000-04-01T11:17,,X,-,
150,-,2000-04-06T16:39,2000-04-07T06:48,2000-04-07T13:33,2000-04-08T06:00,-,-,H,X,-,Weak and uncertain. Could be nothing/HSS but there is T sig
151,152,2000-04-18T17:58,-,2000-04-18T20:33,2000-04-19T02:20,-,2000-04-19T05:24,,X,-,
152,151,-,-,2000-04-19T05:24,2000-04-19T12:00,-,2000-04-19T15:00,,-,-,
153,-,2000-04-24T03:31,-,2000-04-24T04:26,2000-04-24T09:12,2000-04-24T13:39,-,,X,-,
154,-,-,-,-,-,-,-,H,X,W,Is just HSS? Not certain. Ugly if CME
155,-,-,2000-05-07T03:53,2000-05-07T12:28,2000-05-08T05:07,-,2000-05-08T11:59,Y,-,-,Complete guess
156,-,2000-05-13T05:25,2000-05-14T02:36,2000-05-13T17:00,2000-05-14T13:27,-,2000-05-14T18:00,,X,-,
157,-,-,-,2000-05-15T19:00,2000-05-16T14:00,-,-,Y,X,-,Ugly and could be nothing or multiple little FRs
158,-,2000-05-16T23:00,-,2000-05-17T00:00,2000-05-17T04:12,-,2000-05-17T07:00,M2,X,-,
159,160,2000-05-22T17:00,-,2000-05-23T07:28,2000-05-23T17:15,-,2000-05-23T23:42,,X,W,Mixed until next case. Weak signature and guessing
160,159,2000-05-23T23:42,-,2000-05-24T12:00,2000-05-26T15:46,-,-,H,-,W,Wind is drunk. Might just be SIR/HSS and not CME
161,-,2000-06-04T15:02,2000-06-04T19:17,2000-06-05T00:10,2000-06-05T22:30,-,-,H,X,-,Might just be SIR/HSS and not CME?
162,-,2000-06-08T09:07,2000-06-08T13:01,2000-06-08T16:47,2000-06-10T01:18,-,-,M1,X,W?,
163,-,2000-06-11T08:01,-,2000-06-11T09:23,2000-06-11T17:29,-,-,S,X,-,Sheath is nothing?
164,-,2000-06-12T22:08,2000-06-13T03:24,2000-06-13T13:14,2000-06-14T06:00,-,-,Y,GX,-,Generally uncertain
165,-,2000-06-18T10:11,-,2000-06-18T13:27,2000-06-18T18:20,-,-,,X,N,
166,167,2000-06-23T12:57,2000-06-24T01:26,2000-06-24T07:32,2000-06-25T20:18,-,2000-06-26T00:43,H,X,-,Some portion is SIR or HSS plateau?
167,166,2000-06-26T00:43,2000-06-26T05:30,2000-06-26T10:00,2000-06-27T00:00,-,-,M1,X,W,Guessing on mixed. FR just from T sig (and RC bounds)
168,-,2000-07-01T01:54,2000-07-01T06:52,2000-07-01T08:24,2000-07-02T03:34,-,2000-07-02T21:03,M2,-,-,Back mixed uncertain
169,170,2000-07-10T06:00,,2000-07-11T02:00,2000-07-11T12:09,-,-,Y,X,W,Wind is drunk. Sheath too long? FR from only T sig
170,169; 172,2000-07-11T12:09,2000-07-11T17:15,2000-07-11T22:35,2000-07-12T23:49,-,2000-07-13T09:42,Y,-,-,Messy and uncertain
172,170; 173,2000-07-13T09:42,-,2000-07-13T15:35,2000-07-14T02:40,-,2000-07-14T15:32,,-,A,
173,172; 174,2000-07-14T15:32,-,2000-07-14T17:53,2000-07-15T02:23,-,2000-07-15T07:00,,-,AW,
174,173; 175,-,-,2000-07-15T07:00,2000-07-15T14:23,-,-,E,-,AW,Could be nothing
175,174,2000-07-15T14:23,-,2000-07-15T19:53,2000-07-16T09:54,2000-07-17T08:00,-,H,-,AW,Messy. Might be part HSS
176,-,2000-07-19T15:27,2000-07-20T01:40,2000-07-20T08:21,2000-07-21T06:27,-,-,,-,-,Could split up FR?
177,178,2000-07-23T09:50,2000-07-23T15:00,2000-07-23T19:20,2000-07-26T04:10,2000-07-25T05:29,2000-07-26T18:57,,X,W,Guessing on FR split
178,177; 179,2000-07-26T18:57,2000-07-27T02:00,2000-07-27T08:28,2000-07-27T20:53,-,2000-07-28T06:38,,X,-,
179,178,2000-07-28T06:38,2000-07-28T12:00,2000-07-28T14:24,2000-07-29T10:12,-,2000-07-29T18:12,M1,X,-,
180,-,2000-07-31T19:28,-,2000-07-31T23:28,2000-08-01T13:11,-,2000-08-01T17:03,,-,N,
181,182,2000-08-10T05:13,,2000-08-10T20:52,2000-08-11T18:43,-,-,,X,W,
182,181,2000-08-11T18:43,2000-08-12T02:16,2000-08-12T05:31,2000-08-13T02:56,-,-,,X,W,
183,-,-,-,2000-09-02T23:29,2000-09-03T13:00,-,2000-09-03T22:32,,X,-,
184,185,2000-09-04T16:26,2000-09-04T23:25,2000-09-04T21:59,2000-09-05T16:37,-,2000-09-06T02:30,M2,-,-,FR/mixed boundary fairly arbitrary
185,184; 186,-,-,2000-09-06T02:30,2000-09-06T13:14,-,2000-09-06T17:02,M2,X,-,
186,185,2000-09-06T17:02,2000-09-06T20:55,2000-09-07T03:24,2000-09-07T12:41,-,-,,X,-,Not confident in setting rest of Wind cat portion as FR2
187,-,-,-,-,-,-,-,H,X,-,Maybe HSS? Maybe FR from 09-08T18:00 to 09-09T15:00?
188,-,2000-09-17T16:04,-,2000-09-17T23:26,2000-09-18T15:06,2000-09-19T07:21,2000-09-19T12:00,,X,-,Could add front mixed but not sure where. Think back extended region too messy to be FR?
189,190,2000-10-03T01:01,-,2000-10-03T12:09,2000-10-04T14:06,-,2000-10-05T03:34,,X,-,
190,189,2000-10-05T03:34,2000-10-05T11:02,2000-10-05T19:11,2000-10-06T19:39,2000-10-07T11:00,-,,X,-,
191,-,2000-10-12T22:28,2000-10-13T05:55,2000-10-13T17:42,2000-10-14T15:30,-,2000-10-14T19:12,,GX,-,
192,-,2000-10-28T09:27,2000-10-28T20:38,2000-10-29T02:00,2000-10-29T23:22,-,2000-10-30T02:42,,X,-,
193,194,2000-11-06T09:30,2000-11-06T13:26,2000-11-06T22:31,2000-11-07T16:03,-,2000-11-07T20:30,,X,-,
194,193,2000-11-07T18:05,-,2000-11-07T20:30,2000-11-08T03:18,-,-,,X,-,
195,-,2000-11-08T09:59,-,2000-11-08T14:05,2000-11-09T12:11,-,-,E,X,AW,Not confident is a thing
196,197,2000-11-10T06:20,-,2000-11-10T11:02,2000-11-10T17:11,2000-11-10T23:57,2000-11-11T04:00,Y,X,A,Pretty messy so guessing
197,196,2000-11-11T04:00,2000-11-11T07:42,2000-11-11T10:17,2000-11-12T00:00,-,-,,-,-,Could split up FR but back 2/3 looks similar to front 1/3 just more turbulent
198,199,2000-11-26T11:43,-,2000-11-27T09:30,2000-11-27T20:27,2000-11-28T03:00,2000-11-28T05:28,,X,-,Could split up sheath but not sure where
199,198,2000-11-28T05:29,2000-11-28T20:08,2000-11-28T22:28,2000-11-29T16:35,-,2000-11-29T20:58,M1,-,-,
200,-,2000-12-03T03:54,-,2000-12-03T13:07,2000-12-04T12:25,2000-12-05T07:12,-,FR1/FR2,X,-,Messy FR. Not sure if multiple distinct events or single with a lot of ugly sections. Or HSS
201,202,2000-12-21T13:01,2000-12-22T02:04,2000-12-22T08:12,2000-12-22T16:25,-,2000-12-22T19:40,,-,-,
202,201,2000-12-22T19:41,2000-12-22T23:53,2000-12-23T00:50,2000-12-23T06:15,2000-12-23T11:56,-,FR1/FR2,-,-,Worth splitting FR? Going off change in By
203,204,2001-01-23T10:48,2001-01-24T03:12,2001-01-24T09:13,2001-01-24T23:27,2001-01-25T14:43,2001-01-25T21:45,Y,X,-,Messy so generally uncertain
204,203,2001-01-25T21:45,-,2001-01-26T03:23,2001-01-26T09:31,2001-01-26T14:56,-,FR1/FR2,-,-,Messy and weak but seems to have two FR regions
205,-,2001-03-03T11:21,-,2001-03-04T05:57,2001-03-05T02:58,-,-,Y,X,-,Set as one ugly FR as opposed to splitting like Dreams. Very non-ideal FR from HSS behind?
207,-,2001-03-19T11:33,2001-03-19T18:25,2001-03-20T02:28,2001-03-21T05:02,2001-03-22T06:51,2001-03-22T14:00,H,X,-,Guessing on splits. Some portion HSS?
209,-,2001-03-22T14:00,2001-03-22T17:57,2001-03-22T22:30,2001-03-23T04:53,-,-,,X,-,
210,211,2001-03-27T01:59,-,2001-03-27T04:53,2001-03-27T18:11,-,-,H,X,-,Not certain is CME. Might just be SIR/HSS?
211,210,2001-03-27T18:11,-,2001-03-27T23:15,2001-03-28T08:49,-,2001-03-28T17:58,Y,-,-,RC FR is just HSS tail? Uncertain on back mixed region
212,213,2001-03-31T01:21,-,2001-03-31T01:21,2001-03-31T12:23,-,-,Y,X,-,Not sure how to split this and next case
213,212; 214,2001-03-31T12:23,-,2001-03-31T15:00,2001-03-31T22:00,-,-,Y,-,-,Not sure how to split this and prev case
214,213,2001-03-31T22:00,-,2001-04-01T05:27,2001-04-02T19:50,-,2001-04-03T17:54,H,-,AW,Might just be HSS? Not a strong B sig
215,-,2001-04-04T14:55,2001-04-04T18:00,2001-04-04T20:54,2001-04-05T08:22,-,2001-04-05T11:14,,X,-,
216,-,2001-04-08T11:22,2001-04-08T20:01,2001-04-09T01:19,2001-04-10T10:57,-,-,H,X,-,Might just be HSS? Not a strong B sig
217,218,2001-04-11T14:09,2001-04-11T22:48,2001-04-12T08:44,2001-04-13T07:26,-,2001-04-13T08:37,M1,X,-,Could set front mixed as FR1?
218,217,2001-04-13T07:26,-,2001-04-13T13:11,2001-04-14T01:39,2001-04-14T11:18,-,,X,-,Could add back mixed but most of FR2 pretty turbulent
219,-,2001-04-15T16:28,-,2001-04-15T18:04,2001-04-16T02:04,-,-,,-,A,
220,-,2001-04-18T00:46,2001-04-18T05:33,2001-04-18T12:23,2001-04-20T00:00,-,2001-04-20T11:38,,X,-,
221,-,2001-04-21T15:29,2001-04-21T22:39,2001-04-22T06:45,2001-04-23T00:02,-,2001-04-23T04:42,,-,-,
222,-,2001-04-28T05:00,2001-04-28T15:45,2001-04-29T00:53,2001-04-29T12:53,2001-05-01T02:00,2001-05-02T05:15,H,X,-,Some portion of FR2/M2 is HSS?
223,-,-,-,2001-05-03T12:00,2001-05-04T09:05,-,-,E,-,-,Nothing more than T sig
224,-,2001-05-07T17:42,-,2001-05-07T22:17,2001-05-08T08:19,-,2001-05-08T11:01,,X,-,
225,-,-,-,2001-05-09T14:29,2001-05-10T22:50,-,-,H,X,-,Prob a thing. Think RC sheath is SIR/HSS front
226,-,-,-,2001-05-11T14:19,2001-05-12T00:08,-,-,E,-,-,Not certain is a thing
227,-,2001-05-27T14:59,-,2001-05-28T04:55,2001-05-29T06:04,-,2001-05-29T22:12,,X,-,
228,-,2001-06-07T09:29,-,2001-06-07T18:00,2001-06-08T05:31,-,2001-06-08T07:44,,GX,-,
229,-,2001-06-18T20:00,-,2001-06-19T00:41,2001-06-19T14:24,-,-,,GX,-,
230,-,2001-06-26T17:39,2001-06-27T04:36,2001-06-27T10:56,2001-06-28T05:21,-,2001-06-28T16:41,M1,-,-,Front mixed not that dissimilar from main FR?
231,-,2001-07-08T12:00,-,2001-07-09T04:21,2001-07-10T07:42,2001-07-11T20:44,2001-07-12T03:27,Y,X,-,Not sure on splits
232,-,-,-,2001-07-13T17:26,2001-07-14T01:00,-,2001-07-14T01:53,,-,-,
233,-,2001-08-03T07:16,-,2001-08-03T11:51,2001-08-03T14:20,-,-,,X,-,
